[
  {
    "id": "franklin-fobxx",
    "security": {
      "name": "Franklin OnChain U.S. Government Money Fund",
      "issuer": "Franklin Templeton",
      "kind": "money-market-fund",
      "figi": "BBG00XNQN5B5",
      "ticker": "FOBXX",
      "token": "1 BENJI token corresponds to 1 share of the fund."
    },
    "tokens": [
      {
        "chain": "stellar",
        "address": "BENJI:GBHNGLLIE3KWGKCHIKMHJ5HVZHYIK7WTBE4QF5PLAKL4CJGSEU7HZIW5",
        "symbol": "BENJI",
        "source": 1
      },
      {
        "chain": "ethereum",
        "address": "0x3DDc84940Ab509C11B20B76B466933f40b750dc9",
        "symbol": "BENJI",
        "source": 0
      },
      {
        "chain": "polygon",
        "address": "0x408A634B8a8f0dE729B48574a3a7Ec3fE820B00A",
        "symbol": "BENJI",
        "source": 0
      },
      {
        "chain": "arbitrum",
        "address": "0xB9e4765BCE2609bC1949592059B17Ea72fEe6C6A",
        "symbol": "BENJI",
        "source": 0
      },
      {
        "chain": "avalanche",
        "address": "0xE08b4c1005603427420e64252a8b120cacE4D122",
        "symbol": "BENJI",
        "source": 0
      },
      {
        "chain": "base",
        "address": "0x60CfC2b186a4CF647486e42c42B11cC6D571d1E4",
        "symbol": "BENJI",
        "source": 0
      },
      {
        "chain": "aptos",
        "address": "0x7b5e9cac3433e9202f28527f707c89e1e47b19de2c33e4db9521a63ad219b739",
        "symbol": "BENJI",
        "source": 0
      },
      {
        "chain": "solana",
        "address": "5Tu84fKBpe9vfXeotjvfvWdWbAjy3hqsExvuHgFqFxA1",
        "symbol": "BENJI",
        "source": 0
      }
    ],
    "sources": [
      {
        "url": "https://digitalassets.franklintempleton.com/benji/benji-contracts/",
        "publisher": "Franklin Templeton",
        "kind": "issuer-page",
        "checked": "2026-10-29"
      },
      {
        "url": "https://www.franklintempleton.com/.well-known/stellar.toml",
        "publisher": "Franklin Templeton",
        "kind": "stellar-toml",
        "checked": "2026-10-29"
      },
      {
        "url": "https://www.openfigi.com/",
        "publisher": "OpenFIGI",
        "kind": "openfigi",
        "checked": "2026-10-29"
      }
    ],
    "updated": "2026-10-29",
    "attestations": [
      {
        "by": "IoMarkets",
        "key": "iomarkets-assetmap-2026-10",
        "sig": "d0fc83a5a92a4457dba62a81e75ae95a60e046839d74be756ee070debe7f8a9a7929240ecd46b45a328c41098eba7f17b084049da85db96dc23761bc46d03e06"
      }
    ]
  },
  {
    "id": "franklin-onchain-lux-ib",
    "security": {
      "name": "Franklin OnChain U.S. Government Money Fund (gBENJI share class)",
      "issuer": "Franklin Templeton",
      "kind": "money-market-fund",
      "figi": "BBG01QZB6RD8",
      "isin": "LU2900381208",
      "token": "1 gBENJI token corresponds to 1 share of the fund."
    },
    "tokens": [
      {
        "chain": "stellar",
        "address": "gBENJI:GD5J73EKK5IYL5XS3FBTHHX7CZIYRP7QXDL57XFWGC2WVYWT326OBXRP",
        "symbol": "gBENJI",
        "source": 0
      }
    ],
    "sources": [
      {
        "url": "https://www.franklintempleton.com/.well-known/stellar.toml",
        "publisher": "Franklin Templeton",
        "kind": "stellar-toml",
        "checked": "2026-10-29"
      },
      {
        "url": "https://www.openfigi.com/",
        "publisher": "OpenFIGI",
        "kind": "openfigi",
        "checked": "2026-10-29"
      }
    ],
    "updated": "2026-10-29",
    "attestations": [
      {
        "by": "IoMarkets",
        "key": "iomarkets-assetmap-2026-10",
        "sig": "2aabd94266ee5d5d61fefa8dbe2385100770ba9d7b8a96aa4677840fa235b11c63378a466733b5afeb71cdeb732a2275def2c8e46d0ea9069a3a0a0d11912b09"
      }
    ]
  },
  {
    "id": "franklin-onchain-lux-ab-ddis",
    "security": {
      "name": "Franklin OnChain U.S. Government Money Fund AB (Ddis) USD",
      "issuer": "Franklin Templeton",
      "kind": "money-market-fund",
      "figi": "BBG01ZK3RDZ6",
      "isin": "LU3258450587",
      "token": "1 grBENJI token corresponds to 1 share of the fund."
    },
    "tokens": [
      {
        "chain": "stellar",
        "address": "grBENJI:GA3ZBL3LBRKOF7CZ6MCA7JLPHWQCGYCCGKH4GVWNEDZOXW4IPXFGN2FQ",
        "symbol": "grBENJI",
        "source": 0
      }
    ],
    "sources": [
      {
        "url": "https://www.franklintempleton.com/.well-known/stellar.toml",
        "publisher": "Franklin Templeton",
        "kind": "stellar-toml",
        "checked": "2026-10-29"
      },
      {
        "url": "https://www.openfigi.com/",
        "publisher": "OpenFIGI",
        "kind": "openfigi",
        "checked": "2026-10-29"
      }
    ],
    "updated": "2026-10-29",
    "attestations": [
      {
        "by": "IoMarkets",
        "key": "iomarkets-assetmap-2026-10",
        "sig": "94110e075d8e884d015e4d84d93dfc979864cec8e716dc950a3269806a0743cc6425c27da19f70bd248f3f8146f11f69a9d082df3eed4951e242f7e9d5234e01"
      }
    ]
  },
  {
    "id": "franklin-onchain-sg-usd-st",
    "security": {
      "name": "Franklin OnChain U.S. Dollar Short-Term Money Market Fund A(acc)USD",
      "issuer": "Franklin Templeton",
      "kind": "money-market-fund",
      "figi": "BBG01VW1Z1C8",
      "isin": "SGXZ71843866",
      "token": "1 sgBENJI token corresponds to 1 share of the fund."
    },
    "tokens": [
      {
        "chain": "stellar",
        "address": "sgBENJI:GAGICV3VBJSKKH5H5MQQIUTUP462YVHC23KUHZY6FJERRJFBDIVZBM5C",
        "symbol": "sgBENJI",
        "source": 0
      }
    ],
    "sources": [
      {
        "url": "https://www.franklintempleton.com/.well-known/stellar.toml",
        "publisher": "Franklin Templeton",
        "kind": "stellar-toml",
        "checked": "2026-10-29"
      },
      {
        "url": "https://www.openfigi.com/",
        "publisher": "OpenFIGI",
        "kind": "openfigi",
        "checked": "2026-10-29"
      }
    ],
    "updated": "2026-10-29",
    "attestations": [
      {
        "by": "IoMarkets",
        "key": "iomarkets-assetmap-2026-10",
        "sig": "3117e1457f36cb7686a8f58694070e3099a0069e7d6d167a97a38f2eb1b00d683af53cec3a1394452dfd6bfd470f5716c42aa51ae821e6cd23b9b3d17c9a1e0b"
      }
    ]
  },
  {
    "id": "ondo-ousg",
    "security": {
      "name": "Ondo Short-Term US Government Treasuries (OUSG)",
      "issuer": "Ondo Finance",
      "kind": "fund",
      "token": "Each OUSG token represents an interest in a fund holding short-term US Treasuries; transfers are limited to eligible, onboarded holders."
    },
    "tokens": [
      {
        "chain": "ethereum",
        "address": "0x1B19C19393e2d034D8Ff31ff34c81252FcBbee92",
        "symbol": "OUSG",
        "source": 0
      },
      {
        "chain": "polygon",
        "address": "0xbA11C5effA33c4D6F8f593CFA394241CfE925811",
        "symbol": "OUSG",
        "source": 0
      },
      {
        "chain": "solana",
        "address": "i7u4r16TcsJTgq1kAG8opmVZyVnAKBwLKu6ZPMwzxNc",
        "symbol": "OUSG",
        "source": 0
      },
      {
        "chain": "xrpl",
        "address": "4F55534700000000000000000000000000000000.rHuiXXjHLpMP8ZE9sSQU5aADQVWDwv6h5p",
        "symbol": "OUSG",
        "source": 0
      }
    ],
    "sources": [
      {
        "url": "https://docs.ondo.finance/addresses",
        "publisher": "Ondo Finance",
        "kind": "issuer-page",
        "checked": "2026-10-29"
      }
    ],
    "updated": "2026-10-29",
    "attestations": [
      {
        "by": "IoMarkets",
        "key": "iomarkets-assetmap-2026-10",
        "sig": "f14a7b28ff67f38dfa8c902c7d96db07baf26ba4d5e76343a6be846a74330bac3610939ddaef80e5ffbc6a15d8e8dbb65686f64c723062112f7a13eb4643aa01"
      }
    ]
  },
  {
    "id": "ondo-usdy",
    "security": {
      "name": "Ondo US Dollar Yield (USDY)",
      "issuer": "Ondo Finance",
      "kind": "note",
      "token": "Each USDY token is a tokenized note backed by short-term US Treasuries and bank deposits; holders must be eligible under Ondo’s terms."
    },
    "tokens": [
      {
        "chain": "ethereum",
        "address": "0x96F6eF951840721AdBF46Ac996b59E0235CB985C",
        "symbol": "USDY",
        "source": 0
      },
      {
        "chain": "ethereum",
        "address": "0xaf37c1167910ebC994e266949387d2c7C326b879",
        "symbol": "rUSDY",
        "source": 0
      },
      {
        "chain": "bnb",
        "address": "0x608593d17A2decBbc4399e4185bE4922F97eD32E",
        "symbol": "USDY",
        "source": 0
      },
      {
        "chain": "mantle",
        "address": "0x5bE26527e817998A7206475496fDE1E68957c5A6",
        "symbol": "USDY",
        "source": 0
      },
      {
        "chain": "arbitrum",
        "address": "0x35e050d3C0eC2d29D269a8EcEa763a183bDF9A9D",
        "symbol": "USDY",
        "source": 0
      },
      {
        "chain": "plume",
        "address": "0xD2B65e851Be3d80D3c2ce795eB2E78f16cB088b2",
        "symbol": "USDY",
        "source": 0
      },
      {
        "chain": "sei",
        "address": "0x54cD901491AeF397084453F4372B93c33260e2A6",
        "symbol": "USDY",
        "source": 0
      },
      {
        "chain": "tempo",
        "address": "0x20c000000000000000000000D479B9f6eC0ceFf9",
        "symbol": "USDY",
        "source": 0
      },
      {
        "chain": "solana",
        "address": "A1KLoBrKBde8Ty9qtNQUtq3C2ortoC3u7twggz7sEto6",
        "symbol": "USDY",
        "source": 0
      },
      {
        "chain": "sui",
        "address": "0x960b531667636f39e85867775f52f6b1f220a058c4de786905bdf761e06a56bb::usdy::USDY",
        "symbol": "USDY",
        "source": 0
      },
      {
        "chain": "aptos",
        "address": "0xcfea864b32833f157f042618bd845145256b1bf4c0da34a7013b76e42daa53cc::usdy::USDY",
        "symbol": "USDY",
        "source": 0
      },
      {
        "chain": "stellar",
        "address": "USDY:GAJMPX5NBOG6TQFPQGRABJEEB2YE7RFRLUKJDZAZGAD5GFX4J7TADAZ6",
        "symbol": "USDY",
        "source": 0
      },
      {
        "chain": "noble",